[
  {
    "id": "varc.rc.main-idea",
    "name": "Main Idea / Central Theme",
    "section": "VARC",
    "topicId": "varc.rc",
    "prerequisites": [],
    "catFrequency": "high",
    "roiScore": 5,
    "estLearnMinutes": 25,
    "targetSecPerQuestion": 80
  },
  {
    "id": "varc.rc.direct-detail",
    "name": "Direct / Explicit Detail",
    "section": "VARC",
    "topicId": "varc.rc",
    "prerequisites": [],
    "catFrequency": "high",
    "roiScore": 5,
    "estLearnMinutes": 20,
    "targetSecPerQuestion": 70
  },
  {
    "id": "varc.rc.vocab-in-context",
    "name": "Vocabulary-in-Context",
    "section": "VARC",
    "topicId": "varc.rc",
    "prerequisites": [],
    "catFrequency": "medium",
    "roiScore": 4,
    "estLearnMinutes": 20,
    "targetSecPerQuestion": 70
  },
  {
    "id": "varc.rc.structure-function",
    "name": "Structure & Function of a Paragraph",
    "section": "VARC",
    "topicId": "varc.rc",
    "prerequisites": [
      "varc.rc.main-idea"
    ],
    "catFrequency": "medium",
    "roiScore": 3,
    "estLearnMinutes": 25,
    "targetSecPerQuestion": 90
  },
  {
    "id": "varc.rc.inference",
    "name": "Inference",
    "section": "VARC",
    "topicId": "varc.rc",
    "prerequisites": [
      "varc.rc.direct-detail",
      "varc.rc.main-idea"
    ],
    "catFrequency": "high",
    "roiScore": 5,
    "estLearnMinutes": 30,
    "targetSecPerQuestion": 90
  },
  {
    "id": "varc.rc.tone-attitude",
    "name": "Author's Tone & Attitude",
    "section": "VARC",
    "topicId": "varc.rc",
    "prerequisites": [
      "varc.rc.inference"
    ],
    "catFrequency": "medium",
    "roiScore": 3,
    "estLearnMinutes": 25,
    "targetSecPerQuestion": 80
  },
  {
    "id": "varc.rc.assumption",
    "name": "Assumption",
    "section": "VARC",
    "topicId": "varc.rc",
    "prerequisites": [
      "varc.rc.inference"
    ],
    "catFrequency": "medium",
    "roiScore": 3,
    "estLearnMinutes": 25,
    "targetSecPerQuestion": 90
  },
  {
    "id": "varc.rc.strengthen-weaken",
    "name": "Strengthen / Weaken",
    "section": "VARC",
    "topicId": "varc.rc",
    "prerequisites": [
      "varc.rc.assumption"
    ],
    "catFrequency": "low",
    "roiScore": 2,
    "estLearnMinutes": 25,
    "targetSecPerQuestion": 100
  },
  {
    "id": "varc.rc.except-least-likely",
    "name": "Except / Least-likely (Negative Questions)",
    "section": "VARC",
    "topicId": "varc.rc",
    "prerequisites": [
      "varc.rc.inference"
    ],
    "catFrequency": "medium",
    "roiScore": 3,
    "estLearnMinutes": 20,
    "targetSecPerQuestion": 100
  },
  {
    "id": "varc.rc.analogy-application",
    "name": "Analogy / Application",
    "section": "VARC",
    "topicId": "varc.rc",
    "prerequisites": [
      "varc.rc.inference"
    ],
    "catFrequency": "low",
    "roiScore": 2,
    "estLearnMinutes": 20,
    "targetSecPerQuestion": 90
  },
  {
    "id": "varc.va.para-jumbles",
    "name": "Para-jumbles",
    "section": "VARC",
    "topicId": "varc.va",
    "prerequisites": [],
    "catFrequency": "high",
    "roiScore": 5,
    "estLearnMinutes": 30,
    "targetSecPerQuestion": 120
  },
  {
    "id": "varc.va.para-summary",
    "name": "Para-summary",
    "section": "VARC",
    "topicId": "varc.va",
    "prerequisites": [
      "varc.rc.main-idea"
    ],
    "catFrequency": "high",
    "roiScore": 4,
    "estLearnMinutes": 20,
    "targetSecPerQuestion": 75
  },
  {
    "id": "varc.va.odd-sentence-out",
    "name": "Odd-sentence-out / Odd-one-out",
    "section": "VARC",
    "topicId": "varc.va",
    "prerequisites": [
      "varc.va.para-jumbles"
    ],
    "catFrequency": "medium",
    "roiScore": 3,
    "estLearnMinutes": 25,
    "targetSecPerQuestion": 110
  },
  {
    "id": "varc.va.para-completion",
    "name": "Para-completion / Sentence Insertion",
    "section": "VARC",
    "topicId": "varc.va",
    "prerequisites": [
      "varc.va.para-jumbles"
    ],
    "catFrequency": "medium",
    "roiScore": 3,
    "estLearnMinutes": 25,
    "targetSecPerQuestion": 100
  },
  {
    "id": "varc.va.critical-reasoning",
    "name": "Critical Reasoning",
    "section": "VARC",
    "topicId": "varc.va",
    "prerequisites": [
      "varc.rc.assumption"
    ],
    "catFrequency": "low",
    "roiScore": 2,
    "estLearnMinutes": 25,
    "targetSecPerQuestion": 90
  },
  {
    "id": "varc.va.sentence-correction",
    "name": "Sentence Correction",
    "section": "VARC",
    "topicId": "varc.va",
    "prerequisites": [],
    "catFrequency": "rare",
    "roiScore": 1,
    "estLearnMinutes": 20,
    "targetSecPerQuestion": 70
  },
  {
    "id": "varc.va.fill-in-blanks",
    "name": "Fill in the Blanks",
    "section": "VARC",
    "topicId": "varc.va",
    "prerequisites": [],
    "catFrequency": "rare",
    "roiScore": 1,
    "estLearnMinutes": 15,
    "targetSecPerQuestion": 60
  },
  {
    "id": "dilr.di.tables",
    "name": "Tables",
    "section": "DILR",
    "topicId": "dilr.di",
    "prerequisites": [],
    "catFrequency": "high",
    "roiScore": 5,
    "estLearnMinutes": 30,
    "targetSecPerQuestion": 90
  },
  {
    "id": "dilr.di.bar-column",
    "name": "Bar / Column Charts",
    "section": "DILR",
    "topicId": "dilr.di",
    "prerequisites": [
      "dilr.di.tables"
    ],
    "catFrequency": "high",
    "roiScore": 5,
    "estLearnMinutes": 25,
    "targetSecPerQuestion": 90
  },
  {
    "id": "dilr.di.line-charts",
    "name": "Line Charts",
    "section": "DILR",
    "topicId": "dilr.di",
    "prerequisites": [
      "dilr.di.tables"
    ],
    "catFrequency": "medium",
    "roiScore": 4,
    "estLearnMinutes": 20,
    "targetSecPerQuestion": 90
  },
  {
    "id": "dilr.di.pie-charts",
    "name": "Pie Charts",
    "section": "DILR",
    "topicId": "dilr.di",
    "prerequisites": [
      "dilr.di.tables"
    ],
    "catFrequency": "medium",
    "roiScore": 4,
    "estLearnMinutes": 20,
    "targetSecPerQuestion": 90
  },
  {
    "id": "dilr.di.stacked-charts",
    "name": "Stacked Charts",
    "section": "DILR",
    "topicId": "dilr.di",
    "prerequisites": [
      "dilr.di.bar-column"
    ],
    "catFrequency": "medium",
    "roiScore": 3,
    "estLearnMinutes": 25,
    "targetSecPerQuestion": 100
  },
  {
    "id": "dilr.di.radar-spider",
    "name": "Radar / Spider Charts",
    "section": "DILR",
    "topicId": "dilr.di",
    "prerequisites": [
      "dilr.di.bar-column"
    ],
    "catFrequency": "low",
    "roiScore": 2,
    "estLearnMinutes": 20,
    "targetSecPerQuestion": 100
  },
  {
    "id": "dilr.di.bubble-charts",
    "name": "Bubble Charts",
    "section": "DILR",
    "topicId": "dilr.di",
    "prerequisites": [
      "dilr.di.bar-column"
    ],
    "catFrequency": "low",
    "roiScore": 2,
    "estLearnMinutes": 20,
    "targetSecPerQuestion": 100
  },
  {
    "id": "dilr.di.combination-charts",
    "name": "Combination Charts",
    "section": "DILR",
    "topicId": "dilr.di",
    "prerequisites": [
      "dilr.di.bar-column",
      "dilr.di.line-charts"
    ],
    "catFrequency": "medium",
    "roiScore": 3,
    "estLearnMinutes": 30,
    "targetSecPerQuestion": 120
  },
  {
    "id": "dilr.di.caselets",
    "name": "Caselets",
    "section": "DILR",
    "topicId": "dilr.di",
    "prerequisites": [
      "dilr.di.tables"
    ],
    "catFrequency": "high",
    "roiScore": 5,
    "estLearnMinutes": 30,
    "targetSecPerQuestion": 130
  },
  {
    "id": "dilr.di.missing-data",
    "name": "Missing / Incomplete Data Tables",
    "section": "DILR",
    "topicId": "dilr.di",
    "prerequisites": [
      "dilr.di.tables"
    ],
    "catFrequency": "high",
    "roiScore": 5,
    "estLearnMinutes": 30,
    "targetSecPerQuestion": 150
  },
  {
    "id": "dilr.di.data-sufficiency",
    "name": "Data Sufficiency",
    "section": "DILR",
    "topicId": "dilr.di",
    "prerequisites": [
      "dilr.di.tables"
    ],
    "catFrequency": "medium",
    "roiScore": 3,
    "estLearnMinutes": 25,
    "targetSecPerQuestion": 100
  },
  {
    "id": "dilr.di.growth-cagr",
    "name": "Growth Rates, CAGR, Indices & Market Share",
    "section": "DILR",
    "topicId": "dilr.di",
    "prerequisites": [
      "dilr.di.tables",
      "qa.arith.percentages"
    ],
    "catFrequency": "high",
    "roiScore": 5,
    "estLearnMinutes": 35,
    "targetSecPerQuestion": 120
  },
  {
    "id": "dilr.lr.arrangements",
    "name": "Linear & Circular Arrangements",
    "section": "DILR",
    "topicId": "dilr.lr",
    "prerequisites": [],
    "catFrequency": "high",
    "roiScore": 5,
    "estLearnMinutes": 35,
    "targetSecPerQuestion": 120
  },
  {
    "id": "dilr.lr.distribution-grouping",
    "name": "Distribution / Matching / Grouping (2D and 3D)",
    "section": "DILR",
    "topicId": "dilr.lr",
    "prerequisites": [
      "dilr.lr.arrangements"
    ],
    "catFrequency": "high",
    "roiScore": 5,
    "estLearnMinutes": 40,
    "targetSecPerQuestion": 150
  },
  {
    "id": "dilr.lr.selection-conditionalities",
    "name": "Selection & Conditionalities",
    "section": "DILR",
    "topicId": "dilr.lr",
    "prerequisites": [
      "dilr.lr.arrangements"
    ],
    "catFrequency": "medium",
    "roiScore": 4,
    "estLearnMinutes": 30,
    "targetSecPerQuestion": 120
  },
  {
    "id": "dilr.lr.ordering-ranking",
    "name": "Ordering & Ranking, Comparisons",
    "section": "DILR",
    "topicId": "dilr.lr",
    "prerequisites": [
      "dilr.lr.arrangements"
    ],
    "catFrequency": "medium",
    "roiScore": 3,
    "estLearnMinutes": 25,
    "targetSecPerQuestion": 100
  },
  {
    "id": "dilr.lr.games-tournaments",
    "name": "Games & Tournaments",
    "section": "DILR",
    "topicId": "dilr.lr",
    "prerequisites": [
      "dilr.lr.ordering-ranking"
    ],
    "catFrequency": "high",
    "roiScore": 5,
    "estLearnMinutes": 35,
    "targetSecPerQuestion": 140
  },
  {
    "id": "dilr.lr.scheduling",
    "name": "Scheduling & Timetables",
    "section": "DILR",
    "topicId": "dilr.lr",
    "prerequisites": [